{
  "name": "codex",
  "displayName": "Codex CLI",
  "command": "codex-acp",
  "fallbackCommand": "npx",
  "fallbackArgs": ["-y", "@agentclientprotocol/codex-acp"],
  "args": [],
  "capabilities": ["plan", "execute", "verify", "review"],
  "defaultRoles": ["planner", "verifier", "reviewer"],
  "stability": "stable",
  "envPrefix": "CPB_ACP_CODEX",
  "protocol": "acp",
  "description": "OpenAI Codex CLI in ACP mode",
  "lifecycle": "one-shot",
  "resumeCommand": "codex",
  "resumeArgs": ["--resume"]
}
