{
  "name": "{{name}}",
  "displayName": "{{displayName}}",
  "command": "{{command}}",
  "fallbackCommand": "npx",
  "fallbackArgs": ["-y", "{{command}}"],
  "args": [],
  "capabilities": ["plan", "execute", "verify", "review", "remediate"],
  "defaultRoles": ["planner", "executor", "verifier", "reviewer", "remediator"],
  "envPrefix": "CPB_ACP_{{NAME_UPPER}}",
  "stability": "experimental",
  "description": "{{description}}"
}
